Rating,Review
3,"I have been travelling by Indian Railways extensively in Andhra since I was born. The trips took were mostly touching Vijayawada, Vishakhapatnam, Hyderabad, Tirupati, Chennai, Calicut & Bangalore.

The various phases I observed were:

Late 70?s and early eighties:

Coal engines ? Single track ? no safety ? dirty & smelly ? hard beds ? more unreserved coaches ? Lots of beggars ? fun to travel ? food packed from home was the best option - all trains running late all the time.

Late eighties to early nineties:

Diesel engines & electric trains ? Double track ? no ?safety ? still dirty & smelly ? not so hard beds ? less unreserved coaches ? lots of beggars ? fun to travel ? food packed from home or you get sick - few trains running late all the time

Late nineties to now

Lots of electric tracks but still using diesel on some high traffic routes like Bangalore ?tirupati, - Double track ? still no safety ? still dirty & smelly except a few trains like rajadhani, godavari & some intercities. ? not so hard beds ? almost no unreserved coaches compared to the volume of unreserved passengers ? still lots of beggars and eunuchs ? slightly less fun to travel ? food can be had at railways if it is foiled rather than served on tray or paper or leafs but still you might get sick - most trains running on time most of the time ? website with most relevant information.

In 30 years if the railways have progressed this little, that is because other modes of transportation are not available to most places. Only now bus services (especially Volvo & private services) are making inroads in a major way as a preferred way of travelling due to better roads connecting cities.

In most countries where we see ultra fast trains with onetime arrivals the railways improved because they had stiff competition from other modes of transport like airlines, buses and cars. In India we never had airlines for the middle class, nor did we have good roads or good solidly built buses or cars. But that is changing slowly so this should make railways more competitive.

Already there are proposals to introduce bullet trains. But railways should first concentrate on efficiency with online bookings, taking security & complaints within coaches very seriously, easy access to stations, better ergonomically designed coaches with more services to high volume destinations.

I still like the railways for their cheapest services and connecting every nock and corner of the country.

They will have cut the prices on the A/C coaches or else soon there will be no takers for their A/C couches.
"
3,"Indian Railways are a very big organization. It is impossible to cover all its activities in one review. For the purpose of this review I have selected railway catering services. In other words I will try to examine how safe is the food served to passengers travelling by trains run by Indian railways.


Passengers consume various food items during their journey. Many passengers carry with them food items prepared at home and consume them during the journey. Then there are vendors and food stalls/plazas approved by railways who supply food items on platforms and also on trains. Food items are also served in refreshment rooms on platforms.

On many trains food items are served by pantry car. There are also a large number of unapproved vendors serving food items on platforms and on the trains. Then are the food items served by Indian Railways Catering Organization. One such organization is Indian Railway Catering and Tourism Corporation Limited (IRCTC) which is a public sector company set up and fully owned by the Ministry of Railways. IRCTC runs catering services through their own employees and also through contractors.

If you ask passengers about the quality of food served and manner of serving during their journey you will find a mixed response. Some will have complaints to make and some will express general satisfaction. All these responses are based on the fact whether they fell ill or not after the journey. Most of the passengers in India will also say that once you are in journey you can not expect home like food.

Hardly you will find a passenger who had examined the issue from quality and safety point of view. I accept that for a long time I also used to think like this. But due to my current profession of providing training and consultancy on management systems including food safety management systems, I have gained a large experience on this aspect of quality and safety of food. Through this review I wish to share my experience with MS members.

If you visit the Website of IRCTC, you will only find material related to booking of tickets and a horde of advertisements. No direct reference is available about catering although the name of the organization has the word catering. At the bottom of Home Page you will find a toolbar giving three links. Indianrailways.gov.in is the official Website of Indian railways. It also does not provide any information on catering. Then there is a link to ?Air Tickets to India?. In the middle you will find the link to ?Other IRCTC activities?.

When you click on this, you will see a list of these other activities. One out of these is ?Empanelment for on board catering in Trains, Management of Food Plazas and Refreshment Rooms over Indian Railways?. Click on this and you will see an advertisement ?A Grand Business Opportunity? stating terms and conditions for empanelment. One of these conditions is ? ?In addition, the organization must have strict quality control mechanism with mandatory external food quality and hygiene audit comparable with Hazard Analysis Critical Control Points (HACCP) or equivalent Good Industry Practices.? Friends this is the result of my extensive search ? the only reference I could find on Indian Railway Websites on food safety.

Now let me talk something about this food safety. Food safety management systems are based on the concept of Hazard Analysis Critical Control Points (HACCP). In simple language we can describe it as ?ugaane se khaane tak? or in English as ?from field to dining table?. In other words under this system quality and safety of food is ensured at every stage of procurement of raw materials, production, packing, transportation, storage and consumption.

This is ensured through systems of various practices, such as, Good Agricultural Practices, Good Manufacturing Practices, Good Laboratory Practices, Good Hygienic Practices. Safety means preventing any form of contamination in food ? Physical, Chemical, Microbiological. If you remember incidents of finding pesticides in packaged drinking water and other cold drinks ? it was chemical contamination. In case of living organisms found in Cadbury chocolates- it was microbiological contamination.

During my recent trip to Chandigarh on Shatabdi Express I noticed that the paper placed in the food tray had this matter printed on it ? ?Indian Railway?s First ISO 9001: 2000 & HACCP Certified Catering Organization?. Paper packets containing spoon, fork, knife, and tea kit were also printed with this statement. It was a pleasant surprise for me. It is a matter of pride for any Indian that Indian Railways are giving so much importance to safety of food being served to passengers on the train. It has also aroused my interest, as it is not an easy job to Implement ISO 9001and HACCP on a running train.

The first thing I wanted to know was the name of the agency, which has audited the systems and certified them to ISO 9001and HACCP standards. I tried my level best but could not learn the name of that organization. Waiters belong to a contractor?s organization and were not aware of what ISO 9001and HACCP mean. So was the case with train executives.

The manner of serving food was also not of required standards. It has killed my joy. I wanted to find out more. I sent e-mail to IRCTC but received no reply. I searched the Websites and found only a passing reference to food safety.

All this has created a doubt in my mind about the credibility of this claim of Indian Railways, being first ISO 9001:2000 and HACCP certified organization, and also the quality and safety of food. There are so many items served, tea, sugar, milk powder, samosa, biscuits, toffees, butter, jam, tomato ketchup, cooked vegetables, dal, rice, soup, roti. All these items are supplied by different organizations.

How their quality and safety are ensured. Also how the personal hygiene is ensured when people are not aware of the system. I do not want to spoil pleasure of eating in Shatabdi Express but this is the situation I thought I should share with you.

I am still searching and any information if found I will share with you. In the meantime, carry your own food even if the charge of food served in Shatabdi Express is included in your ticket."
4,"Not EveryBody knows INDIAN Railways is the largest organization and a single network in India and Asia.

Infact Indian Railways is the carrier of biggest number of travelers dailay in the world. The huge network, number of employees and huge number of passengers per employee is the basis for making this such a great service and a remarkable organization. So many trains , improving routes and huge traveler groups are the general features of this network.

Why does this huge network not prosper. Do we know the real cost of travel per passenger in a train is sufficcient for the Railways to gather funds for a new train on the same route. Still the big network corporation is running into Losses.

Some body in the Railways authority of India have to realise what canbe improved on major station other than the metros to make this service a pleasure and trustworthy. Many of the trains are running on time and connecting to the metros in a disciplined fashion.

But a large number of trains are known for being late always.

That they never reach late.. Some hard facts are that if you travel from Delhi to Hawra via Patna.. you have 90 % chances to get robbed. that if you travel from a station other than metro even on a reserved seat / birth you are likely forced to share your space with unconfirmed / unticketed passengers.

That if you have boarded a train you can easily travel on a shatabadi train to Punjab unticketed but paying the fare even if the people at the ticketing counter dont get a confirmed space on the same train.

That if you do the above you still dont pay anything to the Railways and the staff on the coach is minting thousands everyweek on selected stations..

That if the authorities get on to it they can easily trace such unfair activities.

That if you are waitlisted and have shown some interest in the interests ofthe TICKET BAABUyou can easily get a space in same or higher compartment. with or without paying a different in upgrade to the Railways account. the Ticket baabuwill take care of it

That you travel if you take care of him.

That you could travel faster train in the last moment if you get space and reach the destination station and get a refund for the train that reaches 3 hours late and for which you had paid extra. The routes and costs are many a times illogical. you spend more to get less if you pay to Railways....

That you spend little more to the Ticket Baabu and you enjoy your travel although there may be someone who needs your seat / birth more than you.

That even if you deserve your seat more .. on the upcoming station you will have to face a tug of war with the Jaats / Biharis (not the jaats / biharis of the region but for the obvious reasons that these people are bullies without sense.)

That if you are a SHAREEF AADMI you dont belong to the Railway services. better take a flight.

DELHI VIDYUT BOARD is an example of loosing money for years ... running in losses for decades and now after Privatization the same network has found ways to logically gather revenue and they are REALLY making huge profits.

Once you got a job in a govt department , that is not the end you need to earn that Job by doing the due service to the same. Wish someone thinks about the irony that the huge network which could accumulate revenue is loosing to its own employees. Wish the employees understood what worth it is ..

Lest if they did not get that job.

Now go to work."
5,"Hi Everyone,

Ever since the controversial decision to make Mr. Laloo Prasad yadav to make the minister of railways was taken, the minister of railways have been making inroads.

Make no mistake, Laloo yadav has been named in many corruption charges and till today the opposition leaves no stone unturned in accusing the government of inducting him into the ministry.

What has Laloo done since he took over as Railways minister?

Since he took over this ministry Laloo has made various changes (though very minor in nature yet effective) and has stressed the importance of having lassi and other milk products to be sold in the stations and not only that, he has conducted surprise checks in the stations which is something that every minister needs to be doing today.

The railway budget proposed certain important changes such as e-procurement , nominal increase in parcel rates, measures to increase passenger security, unreserved ticketing system being a few in the budget.

Now arises a big question as to what the minister of railways needs to do in the near future?

First of all, the connectivity towards eastern states especially needs to increase in the near future. Normally the connectivity is restricted to only Guwahati (though other parts such Itanagar,Shillong etc..are connected to some extent) and not to other parts such as aizawl,agarthala,though the geographical conditions are not that favorable there.

The government needs to bring in the Railways footprint in these areas also as it will increase the connectivity of these places with other parts of the country.

Secondly, the departure and the arrivals of the trains needs to tightened and trains must ensure that they come on time and this is very important as Railways form a major revenue earner for the country and our countrymen still trust the railways and its high time that this organization start delivering, not just promise but in reality too.

The efforts made by the Railways minister are surely in the right direction and let us hope that this is a sustained effort and continues even in the years to come and take Railways on the right track.

"
3,"-----SOME DAYS BEFORE: SOMEWHERE IN BIHAR-----

''Laloo Bihari hamar relway minastarwa banat hai babua!''

''Kya kahat ho Chintu?''

''Aur kahe? Hamare hIndia mein abhi ghor sankat aa sakat hai! Ek naye rel (rail) shadayantra ke liye tayar rehna Pintu!''

''Hum to suna hoon ki Laloo ne Kunal namak ek balak ko apna rel agenda bhi sunaya hai!!''

''Ye sasuri ki baat karat ho bhaiya!''

''Haan! Likhat hai ee Lalwa ulti-siddhi gaddiyaan nikalnewala hai! Patna se siddhe Lahore! Aur Shatabdi Ixprass (express) ko Rabri Ixprass naam dene ki ghoshna bhi kar li hai!''

''Ye to ghor Kalyug hai!''

-----SOME DAYS LATER: DELHI-----

Thus spoke Laloo Yadav, our hon'ble (!!!!! - who say's so?) Railway Minister:

''.....Hamre Bihar me.....sarry.....hIndia me ye jo relway hai, usme humka minastarva banaya hai. Hum pura pradhan tantra hi change karna chahta hoon! Arre, ye sasura rel minastar kay chiz hai! Hum to ek din is desh ka PM banunga!.....''

We used to have a joke in early days that if Laloo is given so and so ministry what will happen! Remember? Now, that day has already come. I just thought of what Laloo might change in the current railway system, and I called up Bihari babu to get a rough idea of what he is upto. And, he e-mailed me his complete agenda itself!

Hamre kantakt bhi kuch kam nahi hai babua!

From: Laloo Yadav (who@laloo.com)

To: Kunal (me@somewhere.com)

Date: (deleted)

Subject: Sasura agenda!

The new Indian Railways will....

Re-introduce steam locos - to boost coal industry in bihar.

Dismantle the reservation system, all seats will be open to janata, no

more reservations by upper cast and rich people.

a/c coaches will be abolished, a/c s will be auctioned in chhapra.

Shatabdi expresses to be renamed as rabri devi express.

10 new trains to be introduced from different parts of bihar to Patna.

All double lines to be reduced to single track to cut costs - the rails,

sleepers etc to be auctioned in muzaffarpore.

Samjhota express will run from patna to peshwar, however it will be
converted to a goods train to carry fodder.

New maha bhoj - litti and sattu - to be served in all luxury trains
palace on wheels, deccan odyssey etc.

Re-zoning of railways: north bihar, south bihar, north eastern bihar,
central bihar, east bihar, south bihar, res! t of India - these will be new

zones.

Next of kin of all people who die in train accidents will be given a job
in railways, no more rail board exam or wastage of public money.

Any driver who dies in a train accident will not be allowed to drive any
more for public safety.

Every village in India will have a railway station by 2007 -
constructions to start soon.

Free tickets for farmers.

De-electrification of major lines to save power. Local trains in Mumbai,

Kolkata, Chennai and Delhi to run on steam too.

Special ''Gaai-bhains'' express for transporting domestic animals, who
have been neglected by the fundamentalist govt.

There will be no ticket checkers in train, that shows the new govt
trusts the people.

Thank you

Laloo Parsad Yadav

-----

Now, you tell me your opinions, please! I can't see our railways moving towards the past!
"
2,"This is my experience regarding parking my bike near the besant nagar's railway reservation counter. Two days before, when I went in the early morning to book railway tickets to nearby besant nagar railway reservation counter.

I have parked my bike in the parking space alloted. We need to pay three rupees for parking our bike in the parking slot. I was asking for a token to the guy who is responsible for issuing them. He said that I can pay it when I return from booking. I returned from booking and then gave three rupees to the corresponding person. He has taken that and said that I can leave. I got somewhat shocked and asked him about the token (red colour slip on which the bike's number has to be written). He takes a token which is torn and gave that to me ( these tokens can be found on the near by premesis where people do normally leave them once they pay the money). I denied and asked him to give me a fresh token. He argued with me and asks me to complain against him to the higher authorities. Infact, you shall get surprised if I say that he had shown me the phone numbers of the higher authorities. After 10 to 15min of argument with this person, he issued a new token.

These persons do not issue the fresh tokens and put all the money they receive into unofficial accounts. The bike's number has to be written on the token and that has to be given to the bike's owner who is parking the bike. This has to be avoided. People who are parking their bikes in the parking slots, take the token and get the bike's number written on the token, so that this shall not happen to others. And before they leave the premesis, please tear the token into pieces, so that they cannot issue these tokens to others by just scribbling the previous number.

It is we who have to take care about all these small issues. The same situation may be prevailing over all the parts of the country. These seem to be small issues.. But, this way of thinking should not be there in the society. Everyone is responsible for his/her work. Making these people understand about their work and their responsibilities is the main task that is left behind.... we also have the right to oppose these activities.

I hope, I have expressed my view in a logical manner and I would have conveyed my suggestion in a proper manner. Thanks for reading my review.
"
5,"2000 percent Increase in the Webtraffic and Online transactions at the Indian Railways online ticketing Portal!!!

Wowowowow!!!

Interesting ain't it? Beleive me its not only interesting, but just too good,and this time its true...the Online ticketing option of the Indian Railways, has helped me to a gr8 extend, I remember the day when I had to go to the Andheri W stn, to get a ticket booked to Delhi, it was hellish nightmare, I actually stood in the Q for close to 2 hours, because the person at the Counter had her own personal problems creeping in once in a while, and to add to it all,the server crashed and no one was there to help the Reservation Staff in getting back things to normalcy....it was crazy, and the heat jus added to it all...

And when it was my turn at the Counter, the train of my choice was full,and the Counter Lady was not willing to tell me of another train, seemed I had to approach the Enquiry counter for that one!! Crazy as hell...I went back to my office, and hit the google site, to see wat it had to offer and to my rescue was the online booking of the I.R...

Click click and click...therez all the info u wanted!!! No rude Lady, no problems with exact change, no wasting time, no nothing, just information, information and more information!

and I booked my first Indian Railway ticket online, and Yipeeee it was delivered at my office address, the very next day, only for a nominal fee of 20 Rs, or was it 30?

the Site is secure, I used my Credit card to get the ticket, that was then, today, they have tie ups with ICICI, Citi bank and so on...and it links directly to ur online account, and debits the same, no hassles watsoever.

Initially the service was only to users in Delhi and Mumbai, today it has grown to lot more cities :

Agra,Ahmedabad,Amritsar,Allahabad,Alapuzha,Aluva,Anand,Agartala,Bangalore,Barod
a,Bhopal,Chandigarh,Coimbatore,Darjeeling,Indore,Chennai,Dehradun,Gandhinagar,Goa
,Kannur,Kochi,Kollam,Haldwani,Hyderabad and Secunderabad,

Kottayam,Kozhikode,Mangalore Jabalpur,Jaipur,Jalandhar,Jammu,Kanpur Mysore,Madurai,Nashik,Palakkad

Kolkata,Lucknow,Ludhiana,Mumbai Rajkot,Siliguri,Shillong,Tiruchchirapalli

Nagpur,Nainital,New Delhi and NCR Tiruppur,Tiruvalla

Patna,Pune,Roorkee,Saharanpur Tiruvananthapuram,Trissur

Silvasa,Surat,Varanasi,Vapi Vijayawada and Vishakapatnam...

For the complete list, please visit, http://www.irctc.co.in

Booking Hours

Week Days : 08:00 AM to 10:00 PM

Sundays : 08:00 AM to 02:00 PM

U have to allow atleast 3 days for delivery just to b on the safe side.

So once u start doing ur booking thru this portal, am sure u are going to have a smile too...like me, I am smiling and am sure, if the Government, the PSUs and the like, if they did dedicate the tax that we pay to such implementations, then India can indeed be smiling!!!

Talking of the Railways, ever wondered how we got the Comfort of toilets in our coaches???? Read on...this letter was taken from one of the archives of the Indian Railways...am sure most of u wud have gone thru it, for the others...


The (in)famous Jackfruit Letter There is a very persistent legend about a letter purportedly written by an irate railway passenger suffering on account of the premature departure of a train. The letter is claimed to have been written around 1909 (a precise date of July 2, 1909 is also sometimes claimed), addressed to the Divisional Office of the East Indian Railway or the Transportation Superintendent at Sahibganj, West Bengal, or to the Railway Board. The letter is said to have been discovered in railway records in West Bengal, or in the Railway Board's archives in New Delhi, or to have been published in the August 1909 issue of 'Indian Railways' (published by the Railway Board). It is very likely that this letter is a legend or joke, even if it was reproduced in an official publication. The text of the letter follows.



Dear Sir,

I am arrive by passenger train at Ahmedpore station, and my belly is too much full of jack fruit. I am therefore went to privy, Just as I doing the nuisance, that guard making whistle blow for train to go off and I am running with lotah in one hand and dhotie in the next hand. I am fall over and expose my shockings to man, females, woman on platform. I am get leaved at Ahmedpore station.

This too much bad, if passenger go to make dung, that dam guard no wait train 5 minutes for him. I am therefore pray your honour to make big fine on that guard for public sake, otherwise I am making big report to papers.

Your faithful servant

Okhil Ch. Sen


take care all...

regards,

me!
"
