Rating,Review
3,"Railways, as once said, r the backbone of a nation. Myself being a working woman & living in city like Mumbai - having to commute to far off distances for work, couldn’t agree more on this.

But come corruption & the complete spirit of it st& lost. I don’t disagree with the growth & the improvements visible in the Indian Railways in the past couple of years & couldn’t help appreciating the facilities being introduced & changes being made in order to provide for comfortable journey for the commuters.

All said & done, while riding high on the wings of progress we sometimes wish to forget that while change is supposed to be the only constant thing, corruption instead is the one thing that is constant in India – a parasite that is multiplying exponentially.

I would share my recent experiences on one of the trains with Indian Railways & would leave it onto the readers to analyze & justify the current situation in the government sector in India & how we as responsible & educated citizens can help in curbing the same.

I along with my family recently happened to travel from New Delhi to Jammu & return, the mode of transportation being Northern Railways. The trains & the respective conditions as experienced, that I am about to describe, r for the following trains:

Uttar S Kranti  - Train No. 2445 - Up

Shalimar Express - Train No. 4645 - Up

Shalimar Express - Train No. 4646 - Down

We were booked on AC 3 tier coach, needless to say that people spare that extra money & book themselves on an AC coach for some basic expectations that includes

Clean coaches

Clean toilets with water availability

Clean & sufficient bedding

Least of all temperature control(at least that’s what the word AC is supposed to mean)

Since the journey is an overnight 12 hour+ journey, these things become the basic necessity & I pity to admit that none, mind me NONE of these facilities were being available in any of these trains throughout.

I would account for these one by one.

As for the clean coaches, since entering the coach we saw a herd of cockroaches marching fearlessly in the coach, climbing the seats & inspecting each commuter & their luggage. The cockroaches never seemed to stop, they kept on coming from nowhere all through the journey to an extend that people had to cover their faces while sleeping to avoid health hazards. I wonder if this was the state of an AC coach what would people in general compartment be going through!

As for temperature control, there was none. We kept waiting for some time initially, but all in vain. It was not until about an hour passed since the train had started, & the heat & suffocation became unbearable, that we finally asked the attendant for AC & lo! here the AC’s started working as if they were just waiting for someone to complain – lets save as much as we can by not switching AC’s on until any of the commuters complain – let them suffer till they can! This was the attitude of the attendant.

Not to mention about the cleanliness of the toilets. I can only sum up saying there was nothing that can be called clean. To top it all there was no water availability & the attendant just kept giving excuses saying that once the train attains speed the water would be available - what crap! The only reason I could see was that the cleaners were all busy selling paper soaps & candies in the coaches. I am not sure if they r even allowed to do so. The frustration of the commuters reached the brim when one of them shouted, “Where & how do u expect us to use these paper soap strips that u r selling every 5 minutes?”

Now comes the best part – when the workers started distributing the bedding for the night, we noticed that there was one sheet missing per person. Though there r supposed to be 2 sheets provided to each commuter, these people were doing away with just 1. On asking they simply said that on this train it’s a norm to give only 1 sheet. We resorted to challenge the same & approached the TT who agreed that these people r playing fowl & they should provide two sheets per person. After a long follow up of about an hour we got remaining one sheet per person for our family. Still the staff didn’t bother to give away the 2nd sheet to any of the other passengers for the simple reason that they did not bother to complain.

The similar thing happened in case of hand towels, No hand towels were issued to travelers & on querying we got the same-recorded response – “We do not have h& towels on this train”. On complaining for this too, suddenly the towels appeared from nowhere, this time again only for our family because we had complaint.

Something very similar happened when we ordered for dinner on these trains. Food is not included in the ticket price on these trains & we need to order & pay for it separately. Very few people know that when u order for food on Indian Railway, a packaged glass of dinking water & a packaged bowl of curd r mandatory to be a part thereof, which obviously were missing from our plates. Forget about the curd, when we asked for water, again the same reply came – “We do not serve water with food on this train”. Now almost accustomed to this answer of theirs, when we told them not to teach us rules, they agreed that it is supposed to be but they forgot to load water today. On further arguments, the staffer selling food, bought from is own pocket, & gave us two 1 liter packaged drinking water bottles. Now anybody can make out why would an employee spend from his own pocket, until he has some guilt to shield… This again, was not provided to other commuters since they never bothered to ask for their rights.

Now just come to think of it, there r hundreds of commuters traveling on these trains at one time & this I am talking of 3 trains that I know of, might be similar situation on hundreds of trains. Just imagine how much money these people r  making for themselves on the governments’ & our expenses. We pay & government provide these things for our usage then who r these people to deny us of our rights & make money for themselves?

They save crates of food supplements supposed to be served to travelers & sell them in the open market to make money. They save on the efforts of distributing, collecting & counting linen & steal on the money saved from laundry of these. I’m sure they must be showing the allowable 5% loss of linen even though they distribute only 40% of the actual linen & sell off the remaining in market to keep their pockets warm.

I would say that it is we who promote & inspire these people to start practices like these; it is we who r to be blamed for their flourishing businesses. Had we bothered & cared to know & raised for our rights, would anybody be able to take advantage like this? Never!

Wake up People – its time we know & practice our rights & help our bit in making the progress measures a success for the nation.
"
1,"Chennai MRTS was launched  with much fanfare in 1998 between Chennai Beach station and Mylapore(lovingly called MYLAI) .We all thought what an innovative way of moving across Chennai.-I too was taken on a free ride along with my parents and children(the ride was free on day 1)

Nine years has passed since .The project is still to be completetd!.The  Genaral Manager, Southern railway announced in January, 2007 that MRTS will run  upto Velachery by March 2007 .I went personally with the family to see  if the work was completed (in Feb, 2007).The track s were not even laid fully .

How can authorities continue to take people for a long ride?.Do they ever get out of their air conditioned offices and go to the field?(ofcourse they do if there is a minister's visit to pose for photographs or if their agency ends up managing an accident, killing people).Shameless officials.

Finally the citizens are also shameless as we continue to take what ever they are offering and end up paying more taxes for useless poor quality services.I encourage you to come and visit some of the MRTS stations and personally undertand what poor quality means.(Stations to visit Light house , Mylapore and Tiruvaamnmyur , visit look around, smell and better be careful  not to fall off !)

Even after reading this if you dont get angry and upset then you desreve to travel in the filthy Suburban rail system and the  poor quality of services from  railways.
"
4,"Indian Railways is Doing tremendous improvement

The Railways has been doing a  tremendous improvement under the able leadership of Shri Laloo Prasad Yadav.

Its really a boon to have online reservations   e-tickets , i-tickets etc., No more standing in queues, paying the touts for a ticket.

But Here I would like to include certain areas in which attention is required.

The First and fore most I would like to talk about is Platform Ticket Vending.

I recently had a close family member visiting Delhi and he was to come in the Hazrat Nizammudin Station. I had arrived well in advance knowing that there will be some or other issue and was taken back to see the Queue in ticket counters. I required a platform ticket and the queue in the counter was really scary but I dared to stand. After standing there for 30mins I thought it would be ridiculous if were to succeed getting the ticket but miss the passenger as the train was due to arrive. I rushed to the platform and was just in time to receive the person. I was on my way back and just as we climbed the steps of the platform I was shocked to see a Checking inspector who was inspecting all the passengers. I anyhow managed to give a slip but. the point here it is really hard to get a platform ticket in stations and this is not only in one station but most of the main stations.

Solution:

One solution could be to install automatic platform ticket vending machines(Even the ones which are used as weighing machines can be used) You pop in the correct change and it gets you back a platform ticket with your weight printed on the back .

*Clean Platforms

*The Condition of the platforms are worse . Stations in places like

Agra

Haridwar

etc.,

Which have religious, tourism related interests should be made world class.

Solution:

Take cue from international Stations like in London/Newyork they are really good.

. Will be continued"
2,"We all know that railways are a monopoly sector in our country. I am not sure whether the suggestion/complaint posted on mouthshut will reach to the concerned authorities or not. But it will atleast be an eye opener for all those who have not yet experinced all this.

Due to flood situation in Gujarat, trains coming from Jodhpur, Rajasthan to Mumbai are running late for last 3-4 days. All media channels are showing this news.

I  tried to find the status on 131 or 132  but was never able to get  the correct information about the number of hours of delay in arrival / departure. To my great surprise at some point of time during the day(on 4th July) on dialing train number 2479 - it was announced ’no information available’

Further more if you select the menu in HINDI, you will not be able to get the message properly. One has to try this to know the reality.

On the website http://www.traininquiry.com most of the times in last 5 days, it was showing the train 2479 or 2480 ’no delay’ in arrival / departure from Bandra Terminus. Even the display system at new built building of this station, do not work.

Several passengers had to stay at platforms, just waiting for trains / correct announcements.
"
1,"I am regular user of Internet and may be the early birds who opted for POP account from VSNL those days standing in the line at VSNL office Churchgate. So basically I know what how and when of Internet and its uses. FEw days back I tried to book Tatkal ticket for my family members and after some time able to get ticket in 3 A/c for two. As per my past practice I checked my Credit card Web site to see how much they have charged me.I was shocked to see that they have charged me four time. Then I got four ticket confirmation also from them. So in one ticket booking I got four ticket, I was bit shocked but then knew these computer mistake happens sometimes due to so many factors. I contacted IRCTC and was shocked to hear that you have doen booking four time in one minute [I must be biggest hacker of Indian IT firm] and being rules of the Railway you have to cancel the tickets and you will be given 25% of value of tkts due to Tatkal tickets.I also wrote to my credit card company to stop payment and register my compliant. So the things are in bit doll drums and I am fighting with both parties to rectify the problem and refund my money.

As per any purchase of railway ticket it should ask you the details of passengers+ other details then it should go to payment gate way they should ask all details and payment to be made. in this case only once they have asked me the details and given four ticket even with all these procedures.

My intention is to inform your member through your site to be care full while registering with IRCTC site. Even after accepting if they donot give confirmation of tkt, do not think that it is not booked they must have booked it and if you again try it new tkt will be issued.

Also even be care full in pressing the buy button if you press two time you wil get two tkts. it totally absurd but it is true.

I am fighting my case but with this review members of this site will be bit educated.

with best regards,

Capt Rajeshwar Singh [retd.]

9819709838
"
3,"I trust that this space is regularly accessed by the PRO of the Indian Railways. I wish to bring to their notice this disturbing  development , increased during recent times. I also wish to warn the would be travellers to take adequate precautions.

The most widely abused date rape drugs in the world are

ativan(lorazepam)

nitravet(nitrazepam). These are odourless, tasteless and can be added to any drink, tea, coffee, coke, soft drinks, lassi etc. In U.S.A. flunitrazepam is used more often and now chloral hydrate (difficult to detect in urine). However, due to ease of availablity, Indians use only the 2 drugs listed above. A person loses sensorium within 15 minutes to 30 mins and has no recollection of the events of the next 6 to 12 hours, depending on the dosage.

In the past 1 month, 6 of my patients have been administered these drugs at the New Delhi, Old Delhi and Hazrat Nizamuddin railway stations. They have been befriended by some one at the station, and offered a drink, cold drink mostly. After 15 minutes, they have lost consciousness and then been looted of all their cash, watch, mobile, baggage. The lucky ones have  awoken at the same spot after 12 hours but those who have been unlucky to start walking after a varied period of time, have been thought to drunk and either bashed up or taken to the police station.

However the honourable Railway minister may notice that very few police stations register their F.IR. as they feel it is the jurisdiction of the R.P.F.

Classically, the persons looted are migrant workers , going home after 6 to 9 months of working in the factories/export houses and going home with atleast 15 grand in cash . Mostly travellers to Jharkhand and Bihar are targetted.

Once they regained senses, they ring up their friends who brought them to me in varied states of dehydration. Gurgaon police say this has not happened in their jurisdiction.

*HISTORICAL FACTS

*The last time I was witness to large scale poisoning and looting was in 1989 to 1991 when posted at military hospital Ambala Cantt.  At the time a large contingent of IPKF was posted in Sri Lanka. The jawans used to be given leave every 3 to 6 months. They used to be airlifted from Chennai to Delhi or Chandigarh , from where they used to catch trains to their destinations. Ambala being a large railway junction, they used to cross it in large numbers. They used to carry cash, VCRs, cameras, canteen items.Cash was a lot since they got leave advance and also some foreign allowance.

We got more than 40 soldiers in varying states of sensorium. The drugs were identified as ativan and nitravet . When combine with alcohol , their effects lasted upto 3 days as dosages given were very huge.

HOW THE PROBLEM WAS TACKLED

The only way we could tackle was through education. Military police and civil police could not keep vigil at all places. So we made frequent announcements on the public address sysems on stations and on radio programmes for faujis. At the unit level also soldiers were briefed by their commanders before proceeding on leave. Finally they were forced to carry bank drafts and not cash. It was 6 months before we got results.

WHAT CAN BE DONE

Now that you have more effective communication methods on stations, like televisions and better audio systems a sustained broadcasting effort must be taken by the railways to warn the public. other media can also be made use of.

Basically the message must be not to accept food/drinks from unknown persons, regardless of how well bred and trustworthy they may appear.

film footage of a few looted passengers can also be shown.

Cases must be registered and followed up with  methodically. Exemplary and swift punishment must be meted out to the offenders.
"
5,"Was Indian Railways a Loss making organization? By Pritis Chandra Majumdar Now and then, particularly when Mr. Laloo Prasad Yadav took over the Indian Railways charge as Railway Minister, some regional and national news paper started to propagate the incorrect message about Indian Railways buttering the minister concerned. Such latest news they published (Bengali and English news paper) is: Indian Railways were running on loss so far and Mr. Laloo made it profit maker with thousands of crores surplus. It is not understood where from this type of unauthentic information the news paper reporters got and what is the authorized source of generation of such desperate incorrect information.

Let us look back and just go through the statistical statements and financial accounts since 1950 to 1997 – 98. There was no year in the past since 1950 as the loosing year except in 1970 – 71 and 1980 – 81 when the losses were19.84 crores and 197.87 crores respectively and the operating ratio in 1970 – 71 and 1980 – 81 were 84.13% and 96.07% respectively. In the last four years from 1994 – 95, 1995 -96, 1996 – 97 and 1997 – 98 the excess were Rs 2, 445.40 crores, Rs. 2, 870.63 crores, Rs.2, 117.06 crores and Rs. 1, 535.22 crores respectively.

These figures are available in the Annual Reports and Accounts of Indian Railways. It was also seen in the same report that in 1950 – 51 and 1960 – 61 the excess were Rs. 15.05 crores and Rs. 32.01 crores when operating ratio was 81.00% and 78.75% respectively.

I personally was involved directly with the railways for about 40 years and as such I got opportunity to share all ups and downs of the railways since 1964. But fortunately, I never saw minister like Mr. Laloo who increased expenditure desperately breaking all rules and policies of the railways like violation of reduction of manpower @ 3% per year, introducing free pass for traveling in trains to PORTERS who are not railway employees and take over-charges than that of actual rate of railways from every passengers taking their assistance for carrying luggage.

Besides, additional recurring expenditure was forced upon the railways after creation of new seven railway zones for new infrastructure and additional posts of man power from General Manager to downwards, creating additional recruitment of Railway Protection Forces etc.

Over and above these huge additional expenditure, he did not raise passengers’ fare during his tenure of office. I travelled in trains and found that nothing passengers’ amenities and facilities were offered after his claim of huge surplus in revenues rather he introduced unhygienic earthen pot for tea and passengers drastically rejected those earthen pot. These earthen cups cost also more than conventional synthetic tea-cup and glass. From the above we can realize that Indian Railways were never running on loss except those two years mentioned above.

Then why reporters are buttering Mr. Laloo publishing incorrect information? This is a question of billion dollars These reporters never referred any authentic reference of railways except Ministers’ verbal press reporting –cum-advertisement with photo session posing as managent guru. What I feel is that actual financial health of Indian Railways will be unearthed after Laloo’s departure from Rail-Mnistership, if not another scam of fodder and other court cases during his Chief Ministership may engulf him. Thus the myth of loss making railway should happily be ignored as the reason might be the his political rival ex-rail minister."
4,"I would like to record my appreciation to the sincere TTE of Jana Shatabdi train (Hubli to B'lore) travelling on 28th Jan'07 in AC chair car coach -C1. The TTE showed his sincerity to his work and real guts in showing the exit to a high profile arrogant person accompained by 2 cops and usual followers.

The high profile person was travelling in a pre-dated ticket, got into a wrong compartment and demanded the seats of a valid ticket holder sitting in his assigned seat in a not so elegant behaviour expected out of such a high profile personaility. A clear indication of disregard and disrespectful behaviour towards the common people.

I was really surprised at the TTE who allocated the vacant seats to the valid waitlisted ticket holders and did not budge to these high profile misusers of power, incidentally can be called as ticketless traveller as they were holding a pre-dated and useless ticket. My sincere appreciation to this TTE. We need people like this and I am sure Indian Railways  will achieve far higher profits by hardwork of these simple people."
2,"I know and have heard of all the hoopla created over the reduction of costs in the luxury trains of the likes of Rajdhani and other AC coaches of superfast trains. We were all happy at the way the rail ministry responded when the air fare fell low enough for the middle class to climb on the roof of the railways and reach out for that plane travel easily. The rail ministry just made the fares for the railway travel fall so that the common man does not think of going towards that air travel and feels happier about using the railways as his sole means of travel. But what they didnt realise is that the quality of service would fall by leaps and bounds.

I know, it sounds a bit cruel on the part of the really comon man who were not able to pay for the luxury travel by railways, and now are actually able to avail of that. But what about the people who were able to pay that little extra and wanted to get that better service which once existed.

I will explain exactly what I mean by the better service. I remember previously in Rajdhani every passenger was enquired of, everything from a broader need like if they needed anything else to the smallest of need like if they could bring some more of that ice cream to cater to that taste bud of yours which might not be quite satisfied by the amount offered. If you are getting me you would understand that I am not talking of the materialistic things . I am talking about their attitude. The fact that they were previously ready to go that extra mile to ensure customer satisfaction. That is what goes missing now .

Yes they charge less, but you will get to see things like Unuchs troubling passengers for money in the normal class from which the ticket checker and the railway security get a share. That is a scene which people have been complaining about for a while now. But what really shook me hard was the introduction of vendors from the station onto the first class coach of Poorva express. Now that was something that was never allowed. Never in the right knowledge could the local vendors from the station board the first class. Then I witnessed an episode of the local vendor arguing with the express officials about the share they have to pay. When I complained to the ticket checker, his responce was very vague as if he just came to know about it and didnt hve any idea as to what action to take. He said that he would be looking into it and disappeared.

Only the official express vendors should be allowed not any vendor . and if they are boarding the train, then where is the security, one of the things I am paying extra for, other than the comfort.

Now you tell me some good reasons as to why I should not reach out for that air travel which saves upto 5 folds the time and is much more comfortable charging about as much as those railways with a bogus service and no sence of customer satisfaction. If they hink they are saving the railways, I would say they are all the more killing it.

The only solution I can think of to prevent the dissatisfied customers to look the air travel way is to have 2 versions of luxury travel like in planes. One where people who are willing to pay can get the right service they are looking for and one the luxury coach meant for the masses where they can continue with their level of service and no one would mind as they would be happy enough to avail of the service."
